{
  "ref": "refs/heads/master",
  "before": "c2c5434853e6c1c712b363bec9805dfefe6d7bb6",
  "after": "e87eead22e741dafb58355b9a6cbcd632c8f3704",
  "created": false,
  "deleted": false,
  "forced": false,
  "base_ref": null,
  "compare": "https://github.com/janhybs/bench-stat/compare/c2c5434853e6...e87eead22e74",
  "commits": [
    {
      "id": "e87eead22e741dafb58355b9a6cbcd632c8f3704",
      "tree_id": "7e8ceefacd592f5a0a151b51b95d6cc9b28af5cd",
      "distinct": true,
      "message": "Change L3 array size from 32 to 44",
      "timestamp": "2018-11-19T08:53:54+01:00",
      "url": "https://github.com/janhybs/bench-stat/commit/e87eead22e741dafb58355b9a6cbcd632c8f3704",
      "author": {
        "name": "Jan Hybš",
        "email": "894428+janhybs@users.noreply.github.com",
        "username": "janhybs"
      },
      "committer": {
        "name": "GitHub",
        "email": "noreply@github.com",
        "username": "web-flow"
      },
      "added": [

      ],
      "removed": [

      ],
      "modified": [
        "benchmarks/main.cc"
      ]
    }
  ],
  "head_commit": {
    "id": "e87eead22e741dafb58355b9a6cbcd632c8f3704",
    "tree_id": "7e8ceefacd592f5a0a151b51b95d6cc9b28af5cd",
    "distinct": true,
    "message": "Change L3 array size from 32 to 44",
    "timestamp": "2018-11-19T08:53:54+01:00",
    "url": "https://github.com/janhybs/bench-stat/commit/e87eead22e741dafb58355b9a6cbcd632c8f3704",
    "author": {
      "name": "Jan Hybš",
      "email": "894428+janhybs@users.noreply.github.com",
      "username": "janhybs"
    },
    "committer": {
      "name": "GitHub",
      "email": "noreply@github.com",
      "username": "web-flow"
    },
    "added": [

    ],
    "removed": [

    ],
    "modified": [
      "benchmarks/main.cc"
    ]
  },
  "repository": {
    "id": 91433299,
    "node_id": "MDEwOlJlcG9zaXRvcnk5MTQzMzI5OQ==",
    "name": "bench-stat",
    "full_name": "janhybs/bench-stat",
    "private": false,
    "owner": {
      "name": "janhybs",
      "email": "894428+janhybs@users.noreply.github.com",
      "login": "janhybs",
      "id": 894428,
      "node_id": "MDQ6VXNlcjg5NDQyOA==",
      "avatar_url": "https://avatars3.githubusercontent.com/u/894428?v=4",
      "gravatar_id": "",
      "url": "https://api.github.com/users/janhybs",
      "html_url": "https://github.com/janhybs",
      "followers_url": "https://api.github.com/users/janhybs/followers",
      "following_url": "https://api.github.com/users/janhybs/following{/other_user}",
      "gists_url": "https://api.github.com/users/janhybs/gists{/gist_id}",
      "starred_url": "https://api.github.com/users/janhybs/starred{/owner}{/repo}",
      "subscriptions_url": "https://api.github.com/users/janhybs/subscriptions",
      "organizations_url": "https://api.github.com/users/janhybs/orgs",
      "repos_url": "https://api.github.com/users/janhybs/repos",
      "events_url": "https://api.github.com/users/janhybs/events{/privacy}",
      "received_events_url": "https://api.github.com/users/janhybs/received_events",
      "type": "User",
      "site_admin": false
    },
    "html_url": "https://github.com/janhybs/bench-stat",
    "description": "Simple repository containing benchmarks simulating numerical computing software",
    "fork": false,
    "url": "https://github.com/janhybs/bench-stat",
    "forks_url": "https://api.github.com/repos/janhybs/bench-stat/forks",
    "keys_url": "https://api.github.com/repos/janhybs/bench-stat/keys{/key_id}",
    "collaborators_url": "https://api.github.com/repos/janhybs/bench-stat/collaborators{/collaborator}",
    "teams_url": "https://api.github.com/repos/janhybs/bench-stat/teams",
    "hooks_url": "https://api.github.com/repos/janhybs/bench-stat/hooks",
    "issue_events_url": "https://api.github.com/repos/janhybs/bench-stat/issues/events{/number}",
    "events_url": "https://api.github.com/repos/janhybs/bench-stat/events",
    "assignees_url": "https://api.github.com/repos/janhybs/bench-stat/assignees{/user}",
    "branches_url": "https://api.github.com/repos/janhybs/bench-stat/branches{/branch}",
    "tags_url": "https://api.github.com/repos/janhybs/bench-stat/tags",
    "blobs_url": "https://api.github.com/repos/janhybs/bench-stat/git/blobs{/sha}",
    "git_tags_url": "https://api.github.com/repos/janhybs/bench-stat/git/tags{/sha}",
    "git_refs_url": "https://api.github.com/repos/janhybs/bench-stat/git/refs{/sha}",
    "trees_url": "https://api.github.com/repos/janhybs/bench-stat/git/trees{/sha}",
    "statuses_url": "https://api.github.com/repos/janhybs/bench-stat/statuses/{sha}",
    "languages_url": "https://api.github.com/repos/janhybs/bench-stat/languages",
    "stargazers_url": "https://api.github.com/repos/janhybs/bench-stat/stargazers",
    "contributors_url": "https://api.github.com/repos/janhybs/bench-stat/contributors",
    "subscribers_url": "https://api.github.com/repos/janhybs/bench-stat/subscribers",
    "subscription_url": "https://api.github.com/repos/janhybs/bench-stat/subscription",
    "commits_url": "https://api.github.com/repos/janhybs/bench-stat/commits{/sha}",
    "git_commits_url": "https://api.github.com/repos/janhybs/bench-stat/git/commits{/sha}",
    "comments_url": "https://api.github.com/repos/janhybs/bench-stat/comments{/number}",
    "issue_comment_url": "https://api.github.com/repos/janhybs/bench-stat/issues/comments{/number}",
    "contents_url": "https://api.github.com/repos/janhybs/bench-stat/contents/{+path}",
    "compare_url": "https://api.github.com/repos/janhybs/bench-stat/compare/{base}...{head}",
    "merges_url": "https://api.github.com/repos/janhybs/bench-stat/merges",
    "archive_url": "https://api.github.com/repos/janhybs/bench-stat/{archive_format}{/ref}",
    "downloads_url": "https://api.github.com/repos/janhybs/bench-stat/downloads",
    "issues_url": "https://api.github.com/repos/janhybs/bench-stat/issues{/number}",
    "pulls_url": "https://api.github.com/repos/janhybs/bench-stat/pulls{/number}",
    "milestones_url": "https://api.github.com/repos/janhybs/bench-stat/milestones{/number}",
    "notifications_url": "https://api.github.com/repos/janhybs/bench-stat/notifications{?since,all,participating}",
    "labels_url": "https://api.github.com/repos/janhybs/bench-stat/labels{/name}",
    "releases_url": "https://api.github.com/repos/janhybs/bench-stat/releases{/id}",
    "deployments_url": "https://api.github.com/repos/janhybs/bench-stat/deployments",
    "created_at": 1494922643,
    "updated_at": "2018-07-30T10:22:01Z",
    "pushed_at": 1542614035,
    "git_url": "git://github.com/janhybs/bench-stat.git",
    "ssh_url": "git@github.com:janhybs/bench-stat.git",
    "clone_url": "https://github.com/janhybs/bench-stat.git",
    "svn_url": "https://github.com/janhybs/bench-stat",
    "homepage": null,
    "size": 124,
    "stargazers_count": 0,
    "watchers_count": 0,
    "language": "C++",
    "has_issues": true,
    "has_projects": true,
    "has_downloads": true,
    "has_wiki": true,
    "has_pages": false,
    "forks_count": 1,
    "mirror_url": null,
    "archived": false,
    "open_issues_count": 0,
    "license": null,
    "forks": 1,
    "open_issues": 0,
    "watchers": 0,
    "default_branch": "master",
    "stargazers": 0,
    "master_branch": "master"
  },
  "pusher": {
    "name": "janhybs",
    "email": "894428+janhybs@users.noreply.github.com"
  },
  "sender": {
    "login": "janhybs",
    "id": 894428,
    "node_id": "MDQ6VXNlcjg5NDQyOA==",
    "avatar_url": "https://avatars3.githubusercontent.com/u/894428?v=4",
    "gravatar_id": "",
    "url": "https://api.github.com/users/janhybs",
    "html_url": "https://github.com/janhybs",
    "followers_url": "https://api.github.com/users/janhybs/followers",
    "following_url": "https://api.github.com/users/janhybs/following{/other_user}",
    "gists_url": "https://api.github.com/users/janhybs/gists{/gist_id}",
    "starred_url": "https://api.github.com/users/janhybs/starred{/owner}{/repo}",
    "subscriptions_url": "https://api.github.com/users/janhybs/subscriptions",
    "organizations_url": "https://api.github.com/users/janhybs/orgs",
    "repos_url": "https://api.github.com/users/janhybs/repos",
    "events_url": "https://api.github.com/users/janhybs/events{/privacy}",
    "received_events_url": "https://api.github.com/users/janhybs/received_events",
    "type": "User",
    "site_admin": false
  }
}
